,Unnamed: 0,#,Owner,Ticker,Asset Name,Transaction Type,Transaction Date,Amount,Comments,Senator Name,Type,Comment
0,,1,Joint,--,Bright Directions 529 Mod Age Bsd 0-02A,Purchase,12/31/2019,"$15,001 - $50,000",Holding of Edward Jones Brokerage #1,"Duckworth, Tammy",,
1,,2,Self,VEU,Vanguard FTSE All-World ex-US Index Fund ETF Share,Sale (Partial),09/23/2019,"$1,001 - $15,000",Holding of IRA #1,"Duckworth, Tammy",,
2,,3,Self,VYM,Vanguard High Dividend Yield Index Fund ETF Shares,Sale (Partial),09/23/2019,"$1,001 - $15,000",Holding of IRA #1,"Duckworth, Tammy",,
3,,4,Self,VIG,Vanguard Dividend Appreciation Index Fund ETF Shar,Sale (Partial),09/23/2019,"$1,001 - $15,000",Holding of IRA #1,"Duckworth, Tammy",,
4,,5,Self,BSV,Vanguard Short-Term Bond Index Fund ETF Shares,Purchase,09/23/2019,"$1,001 - $15,000",Holding of IRA #1,"Duckworth, Tammy",,
5,,6,Self,BIV,Vanguard Intermediate-Term Bond Index Fund ETF Sha,Purchase,09/23/2019,"$1,001 - $15,000",Holding of IRA #1,"Duckworth, Tammy",,
6,,7,Spouse,--,FlexPATH idx+ Mod 2035 11,Purchase,08/01/2019,"$1,001 - $15,000",Holding of Former Employer 401K,"Duckworth, Tammy",,
7,,8,Spouse,PMTIX,Principal LifeTime 2030 Fund Institutional Class,Sale (Full),08/01/2019,"$1,001 - $15,000",Holding of Former Employer 401K,"Duckworth, Tammy",,
8,,1,Joint,RPM,RPM International Inc.,,03/19/2019,"$50,001 - $100,000",,"Sullivan, Dan",Sale (Partial),--
9,,2,Self,GTCSX,Glenmede Small Cap Equity Portfolio Class Advisor,,07/17/2019,"$1,001 - $15,000",,"Sullivan, Dan",Purchase,--
10,,3,Spouse,TSCIX,AMG TimesSquare Small Cap Growth Fund Class Z,,07/17/2019,"$1,001 - $15,000",,"Sullivan, Dan",Purchase,--
11,,4,Self,VPMAX,Vanguard PRIMECAP Fund Admiral Shares,,07/17/2019,"$1,001 - $15,000",,"Sullivan, Dan",Sale (Full),--
12,,5,Joint,IWF,iShares Russell 1000 Growth ETF,,07/17/2019,"$15,001 - $50,000",,"Sullivan, Dan",Sale (Partial),--
13,,6,Joint,MALOX,"BlackRock Global Allocation Fund, Inc. Institution",,07/18/2019,"$1,001 - $15,000",,"Sullivan, Dan",Purchase,--
14,,7,Joint,RPM,RPM International Inc.,,10/08/2019,"$15,001 - $50,000",,"Sullivan, Dan",Sale (Partial),--
15,,1,Self,VPMAX,Vanguard PRIMECAP Fund Admiral Shares,Sale (Full),07/17/2019,"$1,001 - $15,000",Duplicate transaction (previously submitted on PTR).,"Sullivan, Dan",,
16,,2,Self,GTCSX,Glenmede Small Cap Equity Portfolio Class Advisor,Purchase,07/17/2019,"$1,001 - $15,000",Duplicate transaction (previously submitted on PTR).,"Sullivan, Dan",,
17,,3,Child,TSCIX,AMG TimesSquare Small Cap Growth Fund Class Z,Sale (Full),12/06/2019,"$1,001 - $15,000",,"Sullivan, Dan",,
18,,4,Child,TBGVX,"Tweedy, Browne Global Value Fund",Sale (Full),12/06/2019,"$1,001 - $15,000",,"Sullivan, Dan",,
19,,5,Child,WCMIX,WCM Focused International Growth Fund Institutiona,Purchase,12/06/2019,"$1,001 - $15,000",,"Sullivan, Dan",,
20,,6,Child,CCALX,Conestoga Small Cap Institutional Class,Purchase,12/06/2019,"$1,001 - $15,000",,"Sullivan, Dan",,
21,,7,Child,ABCIX,American Beacon The London Company Income Equity F,Purchase,12/06/2019,"$15,001 - $50,000",,"Sullivan, Dan",,
22,,8,Child,WCMIX,WCM Focused International Growth Fund Institutiona,Purchase,12/06/2019,"$1,001 - $15,000",,"Sullivan, Dan",,
23,,9,Child,TBGVX,"Tweedy, Browne Global Value Fund",Sale (Full),12/06/2019,"$1,001 - $15,000",,"Sullivan, Dan",,
24,,10,Child,TSCIX,AMG TimesSquare Small Cap Growth Fund Class Z,Sale (Full),12/05/2019,"$1,001 - $15,000",,"Sullivan, Dan",,
25,,11,Child,WCMIX,WCM Focused International Growth Fund Institutiona,Purchase,12/05/2019,"$1,001 - $15,000",,"Sullivan, Dan",,
26,,12,Child,ABCIX,American Beacon The London Company Income Equity F,Purchase,12/05/2019,"$1,001 - $15,000",,"Sullivan, Dan",,
27,,13,Child,CCALX,Conestoga Small Cap Institutional Class,Purchase,12/05/2019,"$1,001 - $15,000",,"Sullivan, Dan",,
28,,14,Joint,MALOX,"BlackRock Global Allocation Fund, Inc. Institution",Purchase,07/18/2019,"$1,001 - $15,000",Duplicate transaction (previously submitted on PTR).,"Sullivan, Dan",,
29,,15,Spouse,TSCIX,AMG TimesSquare Small Cap Growth Fund Class Z,Purchase,07/18/2019,"$1,001 - $15,000",Duplicate transaction (previously submitted on PTR).,"Sullivan, Dan",,
30,,16,Joint,IWF,iShares Russell 1000 Growth ETF,Sale (Partial),07/17/2019,"$15,001 - $50,000",Duplicate transaction (previously submitted on PTR).,"Sullivan, Dan",,
31,,1,Self,VASGX,Vanguard LifeStrategy Growth Fund Investor Shares,Purchase,08/01/2019,"$50,001 - $100,000",Purchased in SEP IRA,The Honorable Benjamin E Sasse (Former Senator),,
32,,2,Joint,VBR,Vanguard Small-Cap Value Index Fund ETF Shares,Purchase,12/05/2019,"$1,001 - $15,000",,The Honorable Benjamin E Sasse (Former Senator),,
33,,3,Joint,IXUS,iShares Core MSCI Total International Stock ETF,Purchase,12/05/2019,"$15,001 - $50,000",,The Honorable Benjamin E Sasse (Former Senator),,
34,,4,Joint,DFSVX,DFA U.S. Small Cap Value Portfolio Institutional C,Sale (Full),12/05/2019,"$1,001 - $15,000",,The Honorable Benjamin E Sasse (Former Senator),,
35,,5,Joint,DFSVX,DFA U.S. Small Cap Value Portfolio Institutional C,Sale (Partial),07/22/2019,"$1,001 - $15,000",,The Honorable Benjamin E Sasse (Former Senator),,
36,,6,Joint,DFSVX,DFA U.S. Small Cap Value Portfolio Institutional C,Sale (Partial),07/31/2019,"$1,001 - $15,000",,The Honorable Benjamin E Sasse (Former Senator),,
37,,7,Joint,DFTWX,DFA T.A. World ex U.S. Core Equity Portfolio Insti,Sale (Partial),07/31/2019,"$15,001 - $50,000",,The Honorable Benjamin E Sasse (Former Senator),,
38,,8,Joint,DFTWX,DFA T.A. World ex U.S. Core Equity Portfolio Insti,Sale (Full),12/05/2019,"$15,001 - $50,000",,The Honorable Benjamin E Sasse (Former Senator),,
39,,9,Joint,BSV,Vanguard Short-Term Bond Index Fund ETF Shares,Sale (Partial),07/31/2019,"$1,001 - $15,000",,The Honorable Benjamin E Sasse (Former Senator),,
40,,10,Joint,DFGBX,DFA Five-Year Global Fixed Income Portfolio Instit,Sale (Partial),07/31/2019,"$1,001 - $15,000",,The Honorable Benjamin E Sasse (Former Senator),,
41,,11,Joint,VTI,Vanguard Total Stock Market Index Fund ETF Shares,Sale (Partial),07/22/2019,"$1,001 - $15,000",,The Honorable Benjamin E Sasse (Former Senator),,
42,,12,Joint,VTI,Vanguard Total Stock Market Index Fund ETF Shares,Sale (Partial),07/31/2019,"$15,001 - $50,000",,The Honorable Benjamin E Sasse (Former Senator),,
43,,13,Joint,DFAPX,DFA Investment Grade Portfolio Institutional Class,Purchase,07/22/2019,"$1,001 - $15,000",,The Honorable Benjamin E Sasse (Former Senator),,
44,,14,Joint,DFTWX,DFA T.A. World ex U.S. Core Equity Portfolio Insti,Purchase,07/22/2019,"$1,001 - $15,000",,The Honorable Benjamin E Sasse (Former Senator),,
45,,15,Self,DFGEX,DFA Global Real Estate Securities Portfolio,Purchase,12/17/2019,"$1,001 - $15,000",Dividend reinvest in IRA,The Honorable Benjamin E Sasse (Former Senator),,
46,,16,Self,VTI,Vanguard Total Stock Market Index Fund ETF Shares,Purchase,12/31/2019,"$1,001 - $15,000",Dividend reinvest in IRA,The Honorable Benjamin E Sasse (Former Senator),,
47,,17,Self,DFTWX,DFA T.A. World ex U.S. Core Equity Portfolio Insti,Purchase,06/28/2019,"$1,001 - $15,000",Dividend reinvest in IRA,The Honorable Benjamin E Sasse (Former Senator),,
48,,1,Self,--,First Trust Dividend Strength Portfolio Series 35 (FDJDOX),Sale (Full),03/05/2019,"$50,001 - $100,000",,Mr. Doug Jones (Former Senator),,
49,,2,Self,--,First Trust Capital Strength Opportunity Portfolio Series 6 (FDEZNX),Sale (Full),12/14/2019,"$50,001 - $100,000",,Mr. Doug Jones (Former Senator),,
50,,3,Self,--,First Trust Dividend Strength Opportunity Portfolio 6 (FEBDYX),Sale (Full),12/12/2019,"$50,001 - $100,000",,Mr. Doug Jones (Former Senator),,
51,,4,Self,JHAIX,JHancock Multi-Asset Absolute Return Fund Class I,Sale (Full),02/13/2019,"$1,001 - $15,000",,Mr. Doug Jones (Former Senator),,
52,,5,Self,JLPSX,JPMorgan U.S. Large Cap Core Plus Fund Class I Sha,Sale (Full),02/13/2019,"$15,001 - $50,000",,Mr. Doug Jones (Former Senator),,
53,,6,Self,PSMIX,Principal Global Multi-Strategy Fund Institutional,Sale (Full),02/13/2019,"$1,001 - $15,000",,Mr. Doug Jones (Former Senator),,
54,,7,Self,FXAIX,Fidelity 500 Index Fund,Purchase,02/13/2019,"$15,001 - $50,000",,Mr. Doug Jones (Former Senator),,
55,,8,Self,GABCX,Gabelli ABC Fund Class AAA,Purchase,02/13/2019,"$1,001 - $15,000",,Mr. Doug Jones (Former Senator),,
56,,9,Self,MEIIX,MFS Value Fund Class I,Purchase,02/13/2019,"$1,001 - $15,000",,Mr. Doug Jones (Former Senator),,
57,,10,Self,MLAIX,MainStay Winslow Large Cap Growth Fund Class I,Purchase,02/13/2019,"$1,001 - $15,000",,Mr. Doug Jones (Former Senator),,
58,,11,Self,BGCIX,BlackRock Global Long/Short Credit Fund Institutio,Purchase,02/13/2019,"$1,001 - $15,000",,Mr. Doug Jones (Former Senator),,
59,,12,Self,--,Goldman Sachs Financial Square Treasury Instruments Fund (FTIXX),Purchase,02/13/2019,"$1,001 - $15,000",,Mr. Doug Jones (Former Senator),,
60,,13,Self,ACBPX,American Century Diversified Bond Fund I Class,Sale (Full),03/21/2019,"$15,001 - $50,000",,Mr. Doug Jones (Former Senator),,
61,,14,Self,BAGIX,Baird Aggregate Bond Fund Class Institutional,Purchase,03/21/2019,"$15,001 - $50,000",,Mr. Doug Jones (Former Senator),,
62,,15,Self,BAGIX,Baird Aggregate Bond Fund Class Institutional,Purchase,03/22/2019,"$1,001 - $15,000",,Mr. Doug Jones (Former Senator),,
63,,16,Self,--,DWS Enhanced Commodity Strategy Fund (SKIRX),Sale (Full),08/12/2019,"$1,001 - $15,000",,Mr. Doug Jones (Former Senator),,
64,,17,Self,NLSIX,Neuberger Berman Long Short Fund Institutional Cla,Sale (Full),08/12/2019,"$1,001 - $15,000",,Mr. Doug Jones (Former Senator),,
65,,18,Self,POSIX,Principal Global Real Estate Securities Fund Insti,Sale (Full),08/12/2019,"$1,001 - $15,000",,Mr. Doug Jones (Former Senator),,
66,,19,Self,FARCX,Nuveen Real Estate Securities Fund Class I,Sale (Full),08/12/2019,"$1,001 - $15,000",,Mr. Doug Jones (Former Senator),,
67,,20,Self,BGCIX,BlackRock Global Long/Short Credit Fund Institutio,Sale (Full),08/12/2019,"$1,001 - $15,000",,Mr. Doug Jones (Former Senator),,
68,,21,Self,MEDIX,MFS Emerging Markets Debt Fund Class I,Purchase,08/12/2019,"$1,001 - $15,000",,Mr. Doug Jones (Former Senator),,
69,,22,Self,MWTIX,Metropolitan West Total Return Bond Fund Class I,Purchase,08/12/2019,"$15,001 - $50,000",,Mr. Doug Jones (Former Senator),,
70,,23,Self,PHYTX,Principal High Yield Fund Institutional Class,Purchase,08/12/2019,"$1,001 - $15,000",,Mr. Doug Jones (Former Senator),,
71,,24,Self,VSOIX,Victory Sycamore Small Company Opportunity Fund Cl,Purchase,08/12/2019,"$1,001 - $15,000",,Mr. Doug Jones (Former Senator),,
72,,25,Self,AQMIX,AQR Managed Futures Strategy Fund Class I,Sale (Full),08/13/2019,"$1,001 - $15,000",,Mr. Doug Jones (Former Senator),,
73,,26,Self,FXAIX,Fidelity 500 Index Fund,Sale (Partial),08/13/2019,"$1,001 - $15,000",,Mr. Doug Jones (Former Senator),,
74,,27,Self,GABCX,Gabelli ABC Fund Class AAA,Sale (Full),08/13/2019,"$1,001 - $15,000",,Mr. Doug Jones (Former Senator),,
75,,28,Self,OIBYX,Invesco Oppenheimer International Bond Fund Class,Sale (Full),08/13/2019,"$1,001 - $15,000",,Mr. Doug Jones (Former Senator),,
76,,29,Self,--,Goldman Sachs Financial Square Treasury Instruments Fund (FTIXX),Purchase,08/13/2019,"$1,001 - $15,000",,Mr. Doug Jones (Former Senator),,
77,,30,Self,ODVYX,Invesco Oppenheimer Developing Markets Fund Class,Purchase,08/13/2019,"$1,001 - $15,000",,Mr. Doug Jones (Former Senator),,
78,,31,Self,AEPFX,American Funds EuroPacific Growth Fund Class F-2,Purchase,08/13/2019,"$1,001 - $15,000",,Mr. Doug Jones (Former Senator),,
79,,32,Self,WFMIX,Wells Fargo Special Mid Cap Value Fund - Class Ins,Purchase,08/14/2019,"$1,001 - $15,000",,Mr. Doug Jones (Former Senator),,
80,,33,Self,PCBIX,Principal MidCap Fund Institutional Class,Purchase,08/15/2019,"$1,001 - $15,000",,Mr. Doug Jones (Former Senator),,
81,,34,Self,MLAIX,MainStay Winslow Large Cap Growth Fund Class I,Purchase,12/03/2019,"$1,001 - $15,000",,Mr. Doug Jones (Former Senator),,
82,,35,Self,ABYIX,Abbey Capital Futures Strategy Fund Class I,Purchase,12/05/2019,"$1,001 - $15,000",,Mr. Doug Jones (Former Senator),,
83,,36,Self,JCUIX,John Hancock Funds Absolute Return Currency Fund C,Sale (Full),12/06/2019,"$1,001 - $15,000",,Mr. Doug Jones (Former Senator),,
84,,37,Self,PCBIX,Principal MidCap Fund Institutional Class,Purchase,12/12/2019,"$1,001 - $15,000",,Mr. Doug Jones (Former Senator),,
85,,38,Self,AWSHX,American Funds Washington Mutual Investors Fund Cl,Purchase,06/17/2019,"$1,001 - $15,000",,Mr. Doug Jones (Former Senator),,
86,,39,Self,ANCFX,American Funds Fundamental Investors Class A,Purchase,12/23/2019,"$1,001 - $15,000",,Mr. Doug Jones (Former Senator),,
87,,40,Self,AWSHX,American Funds Washington Mutual Investors Fund Cl,Purchase,12/23/2019,"$1,001 - $15,000",,Mr. Doug Jones (Former Senator),,
88,,1,Joint,--,Lake Wedowee Lot,Sale (Full),12/18/2018,"$100,001 - $250,000",,Mr. Doug Jones (Former Senator),,
89,,2,Self,--,First Trust Capital Strength Portfolio Series 35 Cash (FEDYLX),Sale (Full),12/14/2018,"$50,001 - $100,000",Redemption. Portfolio terminated.,Mr. Doug Jones (Former Senator),,
90,,3,Self,--,First Trust Capital Strength Opportunity 1 (FQLMPX),Sale (Full),09/26/2018,"$50,001 - $100,000",Redemption. Portfolio terminated.,Mr. Doug Jones (Former Senator),,
91,,4,Self,--,First Trust Dividend Strength Opportunity Series C (FJLYTX),Sale (Full),10/01/2018,"$50,001 - $100,000",Redemption. Portfolio terminated.,Mr. Doug Jones (Former Senator),,
92,,5,Self,FEBDYX,FT 7583: Dividend Strength Oppo,Purchase,09/28/2018,"$50,001 - $100,000",,Mr. Doug Jones (Former Senator),,
93,,6,Self,FDEZNX,FT 7549: Capital Strength Oppor,Purchase,09/25/2018,"$50,001 - $100,000",,Mr. Doug Jones (Former Senator),,
94,,7,Self,MLAIX,MainStay Large Cap Growth Fund Class I,Purchase,12/04/2018,"$1,001 - $15,000",Reinvestment of dividends.,Mr. Doug Jones (Former Senator),,
95,,8,Self,JLPSX,JPMorgan U.S. Large Cap Core Plus Fund Class I Sha,Purchase,12/03/2018,"$1,001 - $15,000",Reinvestment of dividends.,Mr. Doug Jones (Former Senator),,
96,,9,Self,PCBIX,Principal MidCap Fund Institutional Class,Purchase,12/20/2018,"$1,001 - $15,000",Reinvestment of dividends.,Mr. Doug Jones (Former Senator),,
97,,10,Self,ANCFX,American Funds Fundamental Investors Class A,Purchase,12/24/2018,"$1,001 - $15,000",Reinvestment of dividends.,Mr. Doug Jones (Former Senator),,
98,,11,Self,AWSHX,American Funds Washington Mutual Investors Fund Cl,Purchase,12/24/2018,"$1,001 - $15,000",Reinvestment of dividends.,Mr. Doug Jones (Former Senator),,
99,,12,Self,AWSHX,American Funds Washington Mutual Investors Fund Cl,Purchase,06/18/2018,"$1,001 - $15,000",Reinvestment of dividends.,Mr. Doug Jones (Former Senator),,
100,,13,Self,--,American Bar Association 2030 Retirement Date Fund,Sale (Full),08/31/2018,"$50,001 - $100,000",,Mr. Doug Jones (Former Senator),,
101,,14,Self,--,American Bar Association 2040 Retirement Date Fund,Sale (Full),08/31/2018,"$50,001 - $100,000",,Mr. Doug Jones (Former Senator),,
102,,15,Self,--,American Bar Association 2020 Retirement Date Fund,Purchase,08/31/2018,"$100,001 - $250,000",,Mr. Doug Jones (Former Senator),,
103,,1,Child,--,Massachusetts College Portfolio,Sale (Partial),01/02/2019,"$15,001 - $50,000",,"Casey, Robert P. Jr.",,
104,,1,Joint,XLNX,"Xilinx, Inc.",,02/04/2019,"$1,001 - $15,000",,"Reed, John F.",Sale (Partial),--
105,,2,Joint,VRTX,Vertex Pharmaceuticals Incorporated,,02/04/2019,"$1,001 - $15,000",,"Reed, John F.",Sale (Full),--
106,,3,Joint,SYK,Stryker Corporation,,02/04/2019,"$1,001 - $15,000",,"Reed, John F.",Sale (Partial),--
107,,4,Joint,QCOM,QUALCOMM Incorporated,,02/04/2019,"$1,001 - $15,000",,"Reed, John F.",Sale (Full),--
108,,5,Joint,ISRG,"Intuitive Surgical, Inc.",,02/04/2019,"$1,001 - $15,000",,"Reed, John F.",Sale (Full),--
109,,6,Joint,INTC,Intel Corporation,,02/04/2019,"$1,001 - $15,000",,"Reed, John F.",Sale (Full),--
110,,7,Joint,ITW,Illinois Tool Works Inc.,,02/04/2019,"$1,001 - $15,000",,"Reed, John F.",Sale (Full),--
111,,8,Joint,IQV,IQVIA Holdings Inc.,,02/04/2019,"$1,001 - $15,000",,"Reed, John F.",Sale (Partial),--
112,,9,Joint,HON,Honeywell International Inc.,,02/04/2019,"$1,001 - $15,000",,"Reed, John F.",Sale (Full),--
113,,10,Joint,FDX,FedEx Corporation,,02/04/2019,"$1,001 - $15,000",,"Reed, John F.",Sale (Partial),--
114,,11,Joint,DHR,Danaher Corporation,,02/04/2019,"$1,001 - $15,000",,"Reed, John F.",Sale (Full),--
115,,12,Joint,COST,Costco Wholesale Corporation,,02/04/2019,"$1,001 - $15,000",,"Reed, John F.",Sale (Full),--
116,,13,Joint,CSCO,"Cisco Systems, Inc.",,02/04/2019,"$1,001 - $15,000",,"Reed, John F.",Sale (Full),--
117,,14,Joint,CVS,CVS Health Corporation,,02/04/2019,"$1,001 - $15,000",,"Reed, John F.",Sale (Full),--
118,,15,Joint,AAPL,Apple Inc.,,02/04/2019,"$1,001 - $15,000",,"Reed, John F.",Sale (Partial),--
119,,16,Joint,AMGN,Amgen Inc.,,02/04/2019,"$1,001 - $15,000",,"Reed, John F.",Sale (Full),--
120,,17,Self,AAPL,Apple Inc.,,02/28/2019,"$15,001 - $50,000",,"Reed, John F.",Sale (Full),--
121,,18,Self,ADI,"Analog Devices, Inc.",,02/28/2019,"$1,001 - $15,000",,"Reed, John F.",Sale (Full),--
122,,19,Joint,XLNX,"Xilinx, Inc.",,02/28/2019,"$1,001 - $15,000",,"Reed, John F.",Sale (Full),--
123,,20,Joint,TMO,Thermo Fisher Scientific Inc.,,02/28/2019,"$1,001 - $15,000",,"Reed, John F.",Sale (Full),--
124,,21,Self,XLNX,"Xilinx, Inc.",,02/28/2019,"$15,001 - $50,000",,"Reed, John F.",Sale (Full),--
125,,22,Joint,IQV,IQVIA Holdings Inc.,,02/28/2019,"$1,001 - $15,000",,"Reed, John F.",Sale (Full),--
126,,23,Joint,FDX,FedEx Corporation,,02/28/2019,"$1,001 - $15,000",,"Reed, John F.",Sale (Full),--
127,,24,Joint,AAPL,Apple Inc.,,02/28/2019,"$1,001 - $15,000",,"Reed, John F.",Sale (Full),--
128,,25,Joint,ADI,"Analog Devices, Inc.",,02/28/2019,"$1,001 - $15,000",,"Reed, John F.",Sale (Full),--
129,,26,Joint,SYK,Stryker Corporation,,02/28/2019,"$1,001 - $15,000",,"Reed, John F.",Sale (Full),--
130,,27,Self,TMO,Thermo Fisher Scientific Inc.,,02/28/2019,"$1,001 - $15,000",,"Reed, John F.",Sale (Full),--
131,,28,Self,SYK,Stryker Corporation,,02/28/2019,"$15,001 - $50,000",,"Reed, John F.",Sale (Full),--
132,,29,Self,SLB,Schlumberger Limited,,02/28/2019,"$1,001 - $15,000",,"Reed, John F.",Sale (Full),--
133,,30,Self,QCOM,QUALCOMM Incorporated,,02/28/2019,"$15,001 - $50,000",,"Reed, John F.",Sale (Full),--
134,,31,Self,PEP,"PepsiCo, Inc.",,02/28/2019,"$1,001 - $15,000",,"Reed, John F.",Sale (Full),--
135,,32,Self,MSFT,Microsoft Corporation,,02/28/2019,"$1,001 - $15,000",,"Reed, John F.",Sale (Full),--
136,,33,Self,ISRG,"Intuitive Surgical, Inc.",,02/28/2019,"$1,001 - $15,000",,"Reed, John F.",Sale (Full),--
137,,34,Self,INTC,Intel Corporation,,02/28/2019,"$1,001 - $15,000",,"Reed, John F.",Sale (Full),--
138,,35,Self,IQV,IQVIA Holdings Inc.,,02/28/2019,"$1,001 - $15,000",,"Reed, John F.",Sale (Full),--
139,,36,Self,HOLX,"Hologic, Inc.",,02/28/2019,"$1,001 - $15,000",,"Reed, John F.",Sale (Full),--
140,,37,Self,FDX,FedEx Corporation,,02/28/2019,"$1,001 - $15,000",,"Reed, John F.",Sale (Full),--
141,,38,Self,DHR,Danaher Corporation,,02/28/2019,"$1,001 - $15,000",,"Reed, John F.",Sale (Full),--
142,,39,Self,COST,Costco Wholesale Corporation,,02/28/2019,"$1,001 - $15,000",,"Reed, John F.",Sale (Full),--
143,,40,Self,CELG,Celgene Corporation,,02/28/2019,"$1,001 - $15,000",,"Reed, John F.",Sale (Full),--
144,,41,Self,CVS,CVS Health Corporation,,02/28/2019,"$1,001 - $15,000",,"Reed, John F.",Sale (Full),--
145,,1,Self,FLOT,iShares Floating Rate Bond ETF,Purchase,02/28/2019,"$15,001 - $50,000",,"Reed, John F.",,
146,,2,Self,IEUR,iShares Core MSCI Europe ETF,Purchase,02/28/2019,"$1,001 - $15,000",,"Reed, John F.",,
147,,3,Self,IEMG,iShares Core MSCI Emerging Markets ETF,Purchase,02/28/2019,"$1,001 - $15,000",,"Reed, John F.",,
148,,4,Self,IJH,iShares Core S&P Mid-Cap ETF,Purchase,02/28/2019,"$15,001 - $50,000",,"Reed, John F.",,
149,,5,Self,IVV,iShares Core S&P 500 ETF,Purchase,02/28/2019,"$15,001 - $50,000",,"Reed, John F.",,
150,,6,Self,IJR,iShares Core S&P Small-Cap ETF,Purchase,02/28/2019,"$15,001 - $50,000",,"Reed, John F.",,
151,,7,Self,QQQ,Invesco QQQ Trust,Purchase,02/28/2019,"$1,001 - $15,000",,"Reed, John F.",,
152,,8,Self,PSCH,Invesco S&P SmallCap Health Care ETF,Purchase,02/28/2019,"$1,001 - $15,000",,"Reed, John F.",,
153,,9,Self,PSCT,Invesco S&P SmallCap Information Technology ETF,Purchase,02/28/2019,"$1,001 - $15,000",,"Reed, John F.",,
154,,10,Self,XLK,Technology Select Sector SPDR Fund,Purchase,02/28/2019,"$15,001 - $50,000",,"Reed, John F.",,
155,,11,Self,XLF,Financial Select Sector SPDR Fund,Purchase,02/28/2019,"$15,001 - $50,000",,"Reed, John F.",,
156,,12,Self,XLI,Industrial Select Sector SPDR Fund,Purchase,02/28/2019,"$1,001 - $15,000",,"Reed, John F.",,
157,,13,Self,XLV,Health Care Select Sector SPDR Fund,Purchase,02/28/2019,"$15,001 - $50,000",,"Reed, John F.",,
158,,14,Self,KBE,SPDR S&P Bank ETF,Purchase,02/28/2019,"$1,001 - $15,000",,"Reed, John F.",,
159,,15,Self,FLRN,SPDR Bloomberg Barclays Investment Grade Floating,Purchase,02/28/2019,"$15,001 - $50,000",,"Reed, John F.",,
160,,16,Self,SMH,VanEck Vectors Semiconductor ETF,Purchase,02/28/2019,"$1,001 - $15,000",,"Reed, John F.",,
161,,17,Self,CHIQ,Global X MSCI China Consumer Disc ETF,Sale (Full),02/28/2019,"$1,001 - $15,000",,"Reed, John F.",,
162,,18,Self,IBB,iShares Nasdaq Biotechnology ETF,Sale (Full),02/28/2019,"$1,001 - $15,000",,"Reed, John F.",,
163,,19,Self,IYT,iShares Transportation Average ETF,Sale (Full),02/28/2019,"$1,001 - $15,000",,"Reed, John F.",,
164,,20,Self,PGJ,Invesco Golden Dragon China ETF,Sale (Full),02/28/2019,"$1,001 - $15,000",,"Reed, John F.",,
165,,21,Self,HACK,ETFMG Prime Cyber Security ETF,Sale (Full),02/28/2019,"$1,001 - $15,000",,"Reed, John F.",,
166,,22,Self,XSD,SPDR S&P Semiconductor ETF,Sale (Full),02/28/2019,"$1,001 - $15,000",,"Reed, John F.",,
167,,23,Self,XBI,SPDR S&P Biotech ETF,Sale (Partial),02/28/2019,"$1,001 - $15,000",,"Reed, John F.",,
168,,24,Self,VWO,Vanguard FTSE Emerging Markets Index Fund ETF Shar,Sale (Full),02/28/2019,"$1,001 - $15,000",,"Reed, John F.",,
169,,25,Joint,XSD,SPDR S&P Semiconductor ETF,Sale (Full),02/28/2019,"$1,001 - $15,000",,"Reed, John F.",,
170,,26,Joint,XBI,SPDR S&P Biotech ETF,Sale (Partial),02/28/2019,"$1,001 - $15,000",,"Reed, John F.",,
171,,27,Joint,IEMG,iShares Core MSCI Emerging Markets ETF,Purchase,02/28/2019,"$1,001 - $15,000",,"Reed, John F.",,
172,,28,Joint,IJH,iShares Core S&P Mid-Cap ETF,Purchase,02/28/2019,"$1,001 - $15,000",,"Reed, John F.",,
173,,29,Joint,IVV,iShares Core S&P 500 ETF,Purchase,02/28/2019,"$1,001 - $15,000",,"Reed, John F.",,
174,,30,Joint,IJR,iShares Core S&P Small-Cap ETF,Purchase,02/28/2019,"$1,001 - $15,000",,"Reed, John F.",,
175,,31,Joint,QQQ,Invesco QQQ Trust,Purchase,02/28/2019,"$1,001 - $15,000",,"Reed, John F.",,
176,,32,Joint,XLK,Technology Select Sector SPDR Fund,Purchase,02/28/2019,"$1,001 - $15,000",,"Reed, John F.",,
177,,33,Joint,XLF,Financial Select Sector SPDR Fund,Purchase,02/28/2019,"$1,001 - $15,000",,"Reed, John F.",,
178,,34,Joint,XLI,Industrial Select Sector SPDR Fund,Purchase,02/28/2019,"$1,001 - $15,000",,"Reed, John F.",,
179,,35,Joint,XLV,Health Care Select Sector SPDR Fund,Purchase,02/28/2019,"$1,001 - $15,000",,"Reed, John F.",,
180,,36,Joint,IYT,iShares Transportation Average ETF,Sale (Full),02/04/2019,"$1,001 - $15,000",,"Reed, John F.",,
181,,37,Joint,RYT,Invesco S&P 500 Equal Weight Technology ETF,Sale (Full),02/04/2019,"$1,001 - $15,000",,"Reed, John F.",,
182,,38,Self,IEMG,iShares Core MSCI Emerging Markets ETF,Sale (Partial),03/05/2019,"$1,001 - $15,000",,"Reed, John F.",,
183,,39,Self,KBE,SPDR S&P Bank ETF,Sale (Full),03/05/2019,"$1,001 - $15,000",,"Reed, John F.",,
184,,40,Joint,IEMG,iShares Core MSCI Emerging Markets ETF,Sale (Partial),03/05/2019,"$1,001 - $15,000",,"Reed, John F.",,
185,,41,Joint,IEMG,iShares Core MSCI Emerging Markets ETF,Purchase,09/19/2019,"$1,001 - $15,000",,"Reed, John F.",,
186,,42,Joint,IHI,iShares U.S. Medical Devices ETF,Purchase,09/19/2019,"$1,001 - $15,000",,"Reed, John F.",,
187,,43,Self,IEMG,iShares Core MSCI Emerging Markets ETF,Purchase,09/19/2019,"$1,001 - $15,000",,"Reed, John F.",,
188,,44,Self,IHI,iShares U.S. Medical Devices ETF,Purchase,09/19/2019,"$1,001 - $15,000",,"Reed, John F.",,
189,,45,Self,PSCH,Invesco S&P SmallCap Health Care ETF,Purchase,09/19/2019,"$1,001 - $15,000",,"Reed, John F.",,
190,,46,Self,PSCT,Invesco S&P SmallCap Information Technology ETF,Purchase,09/19/2019,"$1,001 - $15,000",,"Reed, John F.",,
191,,47,Self,XLI,Industrial Select Sector SPDR Fund,Purchase,09/19/2019,"$1,001 - $15,000",,"Reed, John F.",,
192,,48,Self,XLE,Energy Select Sector SPDR Fund,Purchase,09/19/2019,"$1,001 - $15,000",,"Reed, John F.",,
193,,49,Self,XBI,SPDR S&P Biotech ETF,Purchase,09/19/2019,"$1,001 - $15,000",,"Reed, John F.",,
194,,50,Self,XRT,SPDR S&P Retail ETF,Purchase,09/19/2019,"$1,001 - $15,000",,"Reed, John F.",,
195,,51,Self,BIL,SPDR Bloomberg Barclays 1-3 Month T-Bill ETF,Purchase,09/19/2019,"$15,001 - $50,000",,"Reed, John F.",,
196,,52,Self,SMH,VanEck Vectors Semiconductor ETF,Purchase,09/19/2019,"$1,001 - $15,000",,"Reed, John F.",,
197,,53,Self,USFR,WisdomTree Floating Rate Treasury Fund,Purchase,09/19/2019,"$15,001 - $50,000",,"Reed, John F.",,
198,,54,Joint,IJH,iShares Core S&P Mid-Cap ETF,Sale (Full),09/19/2019,"$1,001 - $15,000",,"Reed, John F.",,
199,,55,Joint,IJR,iShares Core S&P Small-Cap ETF,Sale (Partial),09/19/2019,"$1,001 - $15,000",,"Reed, John F.",,
200,,56,Joint,XLF,Financial Select Sector SPDR Fund,Sale (Partial),09/19/2019,"$1,001 - $15,000",,"Reed, John F.",,
201,,57,Self,FLOT,iShares Floating Rate Bond ETF,Sale (Partial),09/19/2019,"$1,001 - $15,000",,"Reed, John F.",,
202,,58,Self,IJH,iShares Core S&P Mid-Cap ETF,Sale (Full),09/19/2019,"$15,001 - $50,000",,"Reed, John F.",,
203,,59,Self,IVV,iShares Core S&P 500 ETF,Sale (Partial),09/19/2019,"$1,001 - $15,000",,"Reed, John F.",,
204,,60,Self,IJR,iShares Core S&P Small-Cap ETF,Sale (Partial),09/19/2019,"$1,001 - $15,000",,"Reed, John F.",,
